[
  {
    "scheme": 0,
    "id": 0,
    "name": "unsignalled",
    "status": "reserved",
    "registered": "2026-09-21",
    "description": "No signal. Default value of all historical blocks and of implementations that do not participate."
  },
  {
    "scheme": 0,
    "id": 67,
    "name": "Gerolamo",
    "status": "active",
    "maintainer": "Harmonic Labs",
    "repository": "https://github.com/HarmonicLabs/gerolamo",
    "payload_specification": null,
    "registered": "2026-09-21",
    "retired": null,
    "description": "TypeScript implementation of the Cardano node."
  },
  {
    "scheme": 0,
    "id": 69,
    "name": "Dingo",
    "status": "active",
    "maintainer": "Blink Labs",
    "repository": "https://github.com/blinklabs-io/dingo",
    "payload_specification": null,
    "registered": "2026-09-21",
    "retired": null,
    "description": "Go implementation of the Cardano node."
  }
]
